1,2,3,4,5,6,7,num,keyword,
201,"Causing disappearance of evidence of offence, or giving false information to screen
offender.—","—Whoever, knowing or having reason to believe that an offence has been committed, causes
any evidence of the commission of that offence to disappear, with the intention of screening the offender
from legal punishment, or with that intention gives any information respecting the offence which he
knows or believes to be false,
",Did the person make an evidence disappear or give false information to protect the offender ?,,,,,,"if a capital offence.—shall, if the offence which he knows or believes to have been committed is punishable with death be punished with imprisonment of either description for a term which may extend to seven years, and shall also be liable to fine; if punishable with imprisonment for life.—and if the offence is punishable with 1 [imprisonment for life], or with imprisonment which may extend to ten years, shall be punished with imprisonment of either description for a term which may extend to three years, and shall also be liable to fine; if punishable with less than ten years’ imprisonment.—and if the offence is punishable with imprisonment for any term not extending to ten years, shall be punished with imprisonment of the description provided for the offence, for a term which may extend to one-fourth part of the longest term of the imprisonment provided for the offence, or with fine, or with both."
202,Intentional omission to give information of offence by person bound to inform,"—Whoever,
knowing or having reason to believe that an offence has been committed, intentionally omits to give any
information respecting that offence which he is legally bound to give, .",Did the accused intentionally omit the information about the offence committed?,,,,,,"shall be punished with imprisonment of either description for a term which may extend to six months, or with fine, or with both."
203,Giving false information respecting an offence committed.—,"Whoever, knowing or having
reason to believe that an offence has been committed, gives any information respecting that offence which
he knows or believes to be false, ",Did the accused give false information about the offence committed?,,,,,,"shall be punished with imprisonment of either description for a term which may extend to two years, or with fine, or with both."
204,Destruction of document to prevent its production as evidence,"Whoever secretes or
destroys any 3
[document and electronic record] which he may be lawfully compelled to produce as
evidence in a Court of Justice, or in any proceeding lawfully held before a public servant, as such, or
obliterates or renders illegible the whole or any part of such 3
[document or electronic record] with the
intention of preventing the same from being produced or used as evidence before such Court or public
servant as aforesaid, or after he shall have been lawfully summoned or required to produce the same for
that purpose, ",Did the accused destroy the document or electronic record which was to be presented as an evidence before the court?,"Did the accused wipe out or render any document or electronic record which was to be presented as an evidence, not clear enough to be read?",,,,,"shall be punished with imprisonment of either description for a term which may extend to two years, or with fine, or with both"
205,False personation for purpose of act or proceeding in suit or prosecution,"—Whoever falsely personates another, and in such assumed character makes any admission or statement, or confesses judgment, or causes any process to be issued or becomes bail or security, or does any other act in any suit or criminal prosecution, ","Did the accused falsely personate another person and make any admission or statement, or confess judgement?",Did the accused falsely personate another person and causes any process to be issued or becomes bail or security?,,,,"Did the accused falsely personate another person and  does any other act in any suit
or criminal prosecution?","shall be punished with imprisonment of either description for a term which may extend to three years, or with fine, or with both."
206,Fraudulent removal or concealment of property to prevent its seizure as forfeited or in execution,"—Whoever fraudulently removes, conceals, transfers or delivers to any person any property or
any interest therein, intending thereby to prevent that property or interest therein from being taken as a
forfeiture or in satisfaction of a fine, under a sentence which has been pronounced, or which he knows to
be likely to be pronounced, by a Court of Justice or other competent authority, or from being taken in
execution of a decree or order which has been made, or which he knows to be likely to be made by a
Court of Justice in a civil suit, ",Is the property involved prevented from being taken as foefeiture or as a fine under a sentence which has been pronounced or is going to be pronounced by court of justice or from being taken in execution of a decree or order?,"Was the property fraudulently removed, concealed, delivered or transferred to some other person?",,,,,"shall be punished with imprisonment of either description for a term which may extend to two years or with fine, or with both."
207,Fraudulent claim to property to prevent its seizure as forfeited or in execution.—,"Whoever
fraudulently accepts, receives or claims any property or any interest therein, knowing that he has no right
or rightful claim to such property or interest, or practices any deception touching any right to any property
or any interest therein, intending thereby to prevent that property or interest therein from being taken as a
forfeiture or in satisfaction of a fine, under a sentence which has been pronounced, or which he knows to
be likely to be pronounced by a Court of Justice or other competent authority, or from being taken in
execution of a decree or order which has been made, or which he knows to be likely to be made by a
Court of Justice in a civil suit,
",Is the property involved prevented from being taken as foefeiture or as a fine under a sentence which has been pronounced or is going to be pronounced by court of justice or from being taken in execution of a decree or order?,"Was the property fraudulently accpeted, received or claimed despite of knowing he has no right on the property?",,,,,"shall be punished with imprisonment of either description for a term which may extend to two years, or with fine, or with both"
208,Fraudulently suffering decree for sum not due,"Whoever fraudulently causes or suffers a
decree or order to be passed against him at the suit of any person for a sum not due or for a larger sum
than is due to such person or for any property or interest in property to which such person is not entitled,
or fraudulently causes or suffers a decree or order to be executed against him after it has been satisfied, or
for anything in respect of which it has been satisfied, ",Did the accused have an intention of annoying or injuring the victim?,,,,,,"shall be punished with imprisonment of either description for a term which may extend to two years, or with fine, or with both."
209,Dishonesty making false claim in Court,"Whoever fraudulently or dishonestly, or with intent
to injure or annoy any person, makes in a Court of Justice any claim which he knows to be false, ",Did the accused make any false claim in the Court of Justice?,,,,,,"shall be punished with imprisonment of either description for a term which may extend to two years, and shall also be liable to fine."
211,False charge of offence made with intent to injure,"Whoever, with intent to cause injury to
any person, institutes or causes to be instituted any criminal proceeding against that person, or falsely
charges any person with having committed an offence, knowing that there is no just or lawful ground for
such proceeding or charge against that person, ",Did the accused institute any criminal proceeding or falsely charge the person for an offence he did not commit?,,,,,,"shall be punished with imprisonment of either description for a term which may extend to two years, or with fine, or with both; and if such criminal proceeding be instituted on a false charge of an offence punishable with death, 1 [imprisonment for life], or imprisonment for seven years or upwards, shall be punishable with imprisonment of either description for a term which may extend to seven years, and shall also be liable to fine"
212,Harbouring offender,"Whenever an offence has been committed, whoever harbours or conceals a person whom he knows or has reason to believe to be the offender, with the intention of screening him from legal punishment.",DId the accused conceal a person who he thinks is an offender,did the accused do so to prevent the offender's legal punishments,,,,,"if a capital offence.—shall, if the offence is punishable with death, be punished with imprisonment of either description for a term which may extend to five years, and shall also be liable to fine; if punishable with imprisonment for life, or with imprisonment.—and if the offence is punishable with 1 [imprisonment for life], or with imprisonment which may extend to ten years, shall be punished with imprisonment of either description for a term which may extend to three years, and shall also be liable to fine; and if the offence is punishable with imprisonment which may extend to one year, and not to ten years, 
shall be punished with imprisonment of the description provided for the offence for a term which may 
extend to one-fourth part of the longest term of imprisonment provided for the offence, or with fine, or with 
both."
213,"Taking gift, etc., to screen an offender from punishment","Whoever accepts or attempts to
obtain, or agrees to accept, any gratification for himself or any other person, or any restitution of property
to himself or any other person, in consideration of his concealing an offence or of his screening any
person from legal punishment for any offence, or of his not proceeding against any person for the purpose
of bringing him to legal punishment,
",Did the accused accept or agree to accept or attempt to obtain any gift or property from someone to conceal his offence or screen him from legal punishment?,,,,,,"if a capital offence.—shall, if the offence is punishable with death, be punished with imprisonment of either description for a term which may extend to seven years, and shall also be liable to fine; if punishable with imprisonment for life, or with imprisonment.—and if the offence is punishable with 3 [imprisonment for life], or with imprisonment which may extend to ten years, shall be punished with imprisonment of either description for a term which may extend to three years, and shall also be liable to fine; and if the offence is punishable with imprisonment not extending to ten years, shall be punished with imprisonment of the description provided for the offence for a term which may extend to one fourth part of the longest term of imprisonment provided for the offence, or with fine, or with both."
214,Offering gift or restoration of property in consideration of screening offender,"Whoever
gives or causes, or offers or agrees to give or cause, any gratification to any person, or 2
[restores or causes
the restoration of] any property to any person, in consideration of that person's concealing an offence, or
of his screening any person from legal punishment for any offence, or of his not proceeding against any
person for the purpose of bringing him to legal punishment,
",Did the accused offer or agree to offer or give any gifts or property to someone to conceal his offence or screen him from any legal punishment?,,,,,,"if a capital offence.—shall, if the offence is punishable with death, be punished with imprisonment of either description for a term which may extend to seven years, and shall also be liable to fine; if punishable with imprisonment for life, or with imprisonment.—and if the offence is punishable with 3 [imprisonment for life] or with imprisonment which may extend to ten years, shall be punished with imprisonment of either description for a term which may extend to three years, and shall also be liable to fine; and if the offence is punishable with imprisonment not extending to ten years, shall be punished with imprisonment of the description provided for the offence for a term which may extend to one-fourth part of the longest term of imprisonment provided for the offence, or with fine, or with both."
215,"Taking gift to help to recover stolen property, etc.—","Whoever takes or agrees or consents to take any gratification under pretence or on account of helping any person to recover any movable property of which he shall have been deprived by any offence punishable under this Code, shall, unless he uses all means in his power to cause the offender to be apprehended and convicted of the offence, ",Did the person take any gifts to recover any stolen property?,,,,,,"be punished with imprisonment of either description for a term which may extend to two years, or with fine, or with both."
216,Harbouring offender who has escaped from custody or whose apprehension has been ordered.,"—Whenever any person convicted of a charged with an offence, being in lawful custody for that
offence, escapes from such custody,or whenever a public servant, in the exercise of the lawful powers of such public servant, orders a
certain person to be apprehended for an offence, whoever, knowing of such escape or order for
apprehension, harbours or conceals that person with the intention of preventing him from being
apprehended, shall be punished in the manner following, that is to say,
if a capital offence.—if the offence for which the person was in custody or is ordered to be
apprehended is punishable with death, he shall be punished with imprisonment of either description for a
term which may extend to seven years, and shall also be liable to fine;
if punishable with imprisonment for life, or with imprisonment.—if the offence is punishable
with 1
[imprisonment for life] or imprisonment for ten years, he shall be punished with imprisonment of
either description for a term which may extend to three years, with or without fine;
and if the offence is punishable with imprisonment which may extend to one year and not to ten
years, he shall be punished with imprisonment of the description provided for the offence for a term
which may extend to one-fourth part of the longest term of the imprisonment provided for such offence,
or with fine, or with both.
2
[“Offence” in this section includes also any act or omission of which a person is alleged to have been
guilty out of 3
[India], which, if he had been guilty of it in 3
[India], would have been punishable as an
offence, and for which he is, under any law relating to extradition, 4
*** or otherwise, liable to be
apprehended or detained in custody in 3
[India], and every such act or omission shall, for the purposes of
this section, be deemed to be punishable as if the accused person had been guilty of it in 3
[India].]
",Did the accused harbour or conceal a person who escaped lawful custody ?,Did the accused harbour or conceal a public servant whose apprehension was ordered?,,,,,"if a capital offence.—if the offence for which the person was in custody or is ordered to be apprehended is punishable with death, he shall be punished with imprisonment of either description for a term which may extend to seven years, and shall also be liable to fine; if punishable with imprisonment for life, or with imprisonment.—if the offence is punishable with 3 [imprisonment for life] or imprisonment for ten years, he shall be punished with imprisonment of either description for a term which may extend to three years, with or without fine; and if the offence is punishable with imprisonment which may extend to one year and not to ten years, he shall be punished with imprisonment of the description provided for the offence for a term which may extend to one-fourth part of the longest term of the imprisonment provided for such offence, or with fine, or with both."
217,". Public servant disobeying direction of law with intent to save person from punishment or
property from forfeiture.—","Whoever, being a public servant, knowingly disobeys any direction of the
law as to the way in which he is to conduct himself as such public servant, intending thereby to save, or
knowing it to be likely that he will thereby save, any person from legal punishment, or subject him to a
less punishment than that to which he is liable, or with intent to save, or knowing that he is likely thereby
to save, any property from forfeiture or any charge to which it is liable by law, .",Is the accused a public servant?,Did the public servant disobey law to save a person from legal punishment he was entitled to?,,,,,"shall be punished with imprisonment of either description for a term which may extend to two years, or with fine, or with both."
218,Public servant framing incorrect record or writing with intent to save person from punishment or property from forfeiture,"Whoever, being a public servant, and being as such public
servant, charged with the preparation of any record or other writing, frames that record or writing in a
manner which he knows to be incorrect, with intent to cause, or knowing it to be likely that he will
thereby cause, loss or injury to the public or to any person, or with intent thereby to save, or knowing it to
be likely that he will thereby save, any person from legal punishment, or with intent to save, or knowingthat he is likely thereby to save, any property from forfeiture or other charge to which it is liable by law,
",Did the public servant frame incorrect records which caused loss or injury to the public?,Did he do this with an intention to save an offender from legal punishment?,,,,,"shall be punished with imprisonment of either description for a term which may extend to three years, or with fine, or with both."
219,"Public servant in judicial proceeding corruptly making report, etc., contrary to law","Whoever, being a public servant, corruptly or maliciously makes or pronounces in any stage of a judicial
proceeding, any report, order, verdict, or decision which he knows to be contrary to law, ","Did the public servant corruptly make any report,order,verdict or decision against the law during a judicial proceeding?",,,,,,"shall be punished with imprisonment of either description for a term which may extend to seven years, or with fine, or with both"
220,"Commitment for trial or confinement by person having authority who knows that he is
acting contrary to law.—","—Whoever, being in any office which gives him legal authority to commit
persons for trial or to confinement, or to keep persons in confinement, corruptly or maliciously commits
any person for trial or to confinement, or keeps any person in confinement, in the exercise of that
authority knowing that in so doing he is acting contrary to law, ",Was the accused legally authorised to commit persons for trial or keep them in confinement?,Did the accused corruptly commit a person for trial or keep him in confinement against the law?,,,,,"shall be punished with imprisonment of either description for a term which may extend to seven years, or with fine, or with both."
221,Intentional omission to apprehend on the part of public servant bound to apprehend,"Whoever, being a public servant, legally bound as such public servant to apprehend or to keep in
confinement any person charged with or liable to be apprehended for an offence, intentionally omits to
apprehend such person, or intentionally suffers such person to escape, or intentionally aids such person in
escaping or attempting to escape from such confinement, shall be punished.",Was the Public servant supposed to arrest or confine the persone accused withthe crime,Did the public servant intentionally omit the arrest of the person accused with the crime,,,,,"shall be punished as follows, that is to say:— with imprisonment of either description for a term which may extend to seven years, with or without fine, if the person in confinement, or who ought to have been apprehended, was charged with, or liable to be apprehended for, an offence punishable with death; or with imprisonment of either description for a term which may extend to three years, with or without fine, if the person in confinement, or who ought to have been apprehended, was charged with, or liable to be apprehended for, an offence punishable with 1 [imprisonment for life] or imprisonment for a term which may extend to ten years; or with imprisonment of either description for a term which may extend to two years, with or without fine, if the person in confinement, or who ought to have been apprehended, was charged with, or liable to be apprehended for, an offence punishable with imprisonment for a term less than ten years."
222,"Intentional omission to apprehend on the part of public servant bound to apprehend
person under sentence or lawfully committed.—","Whoever, being a public servant, legally bound as
such public servant to apprehend or to keep in confinement any person under sentence of a Court of
Justice for any offence 2
[or lawfully committed to custody], intentionally omits to apprehend such person,
or intentionally suffers such person to escape or intentionally aids such person in escaping or attempting
to escape from such confinement, ",Was the Public servant supposed to arrest or confine the criminal sentenced by the court of justice ,Did the public servant intentionally omit the arrest of the criminal,,,,,"with 1 [imprisonment for life] or with imprisonment of either description for a term which may extend to fourteen years, with or without fine, if the person in confinement, or who ought to have been apprehended, is under sentence of death; or with imprisonment of either description for a term which may extend to seven years, with or without fine, if the person in confinement or who ought to have been apprehended, is subject, by a sentence of a Court of Justice, or by virtue of a commutation of such sentence, to 1 [imprisonment for life] 2*** 3*** 4*** 5*** or imprisonment for a term of ten years, or upwards; or with imprisonment of either description for a term which may extend to three years, or with fine, or with both, if the person in confinement or who ought to have been apprehended is subject by a sentence of a Court of Justice, to imprisonment for a term not extending to ten years 6 [or if the person was lawfully committed to custody"
223,Escape from confinement or custody negligently suffered by public servant,"Whoever,
being a public servant legally bound as such public servant to keep in confinement any person charged
with or convicted of any offence 
[or lawfully committed to custody], negligently suffers such person to
escape from confinement, 
",Did the person escape from confinement or custody beacuse of negligence of the public servant?,,,,,,"shall be punished with simple imprisonment for a term which may extend to two years, or with fine, or with both"
224,. Resistance or obstruction by a person to his lawful apprehension.—,"Whoever intentionally
offers any resistance or illegal obstruction to the lawful apprehension of himself for any offence with
which he is charged or of which he has been convicted, or escapes or attempts to escape from any custody
in which he is lawfully detained for any such offence, ",Did the accused offer resistance or illegal obstruction to hi lawful apprehension?,Did the accused escape or try to escape from legal custody?,,,,,"shall be punished with imprisonment of either description for a term which may extend to two years, or with fine, or with both."
225,Resistance or obstruction to lawful apprehension of another person,"Whoever intentionally
offers any resistance or illegal obstruction to the lawful apprehension of any other person for an offence,
or rescues or attempts to rescue any other person from any custody in which that person is lawfully
detained for an offence, ","did the accused intentionally offer resistance, illegal obstruction, rescued or attempted to rescue to the arrest of any person liable for an offence",,,,,,"shall be punished with imprisonment of either description for a term which may extend to two years, or with fine, or with both; or, if the person to be apprehended, or the person rescued or attempted to be rescued, is charged with or liable to be apprehended for an offence punishable with 1 [imprisonment for life] or imprisonment for a term which may extend to ten years, shall be punished with imprisonment of either description for a term which may extend to three years, and shall also be liable to fine; or, if the person to be apprehended, or rescued, or attempted to be rescued, is charged with or liable to be apprehended for an offence punishable with death, shall be punished with imprisonment of either description for a term which may extend to seven years, and shall also be liable to fine; or, if the person to be apprehended or rescued, or attempted to be rescued, is liable under the sentence of a Court of Justice, or by virtue of a commutation of such a sentence, to 1 [imprisonment for life], 3*** 4*** 5*** or imprisonment, for a term of ten years, or upwards, shall be punished with imprisonment of either description for a term which may extend to seven years, and shall also be liable to fine; or, if the person to be apprehended or rescued, or attempted to be rescued, is under sentence of death, shall be punished with 1 [imprisonment for life] or imprisonment of either description for a term not exceeding ten years, and shall also be liable to fine"
