1,2,3,4,5,6,7,num,keyword,
109,Punishment of abetment if the act abetted is committed in consequence and where no express provision is made for its punishment. influence ,"Whoever abets any offense shall, if the act abetted is
committed in consequence of the abetment, and no express provision is made by this Code for the
punishment of such abetment, be punished with the punishment provided for the offense.
Influence, Instigate, affect.",Was the accused instigated by somebody?,,,,,"Influence, Instigate, affect",
110,"Punishment of abetment if person abetted does act with different intention from that of
abettor. Influence ","Whoever abets the commission of an offence shall, if the person abetted does the act with a
different intention or knowledge from that of the abettor, be punished with the punishment provided for
the offence which would have been committed if the act had been done with the intention or knowledge
of the abettor and with no other. Threatened, abetment, influence",Was the accused instigated by somebody?,Were the intentions of accused different from the second person's intentions,,,,"Threatened, abetment, influence",
112,Abettor when liable to cumulative punishment for act abetted and for act done.,"If the act
for which the abettor is liable under the last preceding section is committed in addition to the act abetted,
and constitute a distinct offence, the abettor is liable to punishment for each of the offences. abetment, influence, threatened",Was the accused instigated by somebody?,Were the intentions of accused different from the second person's intentions,,,,"abetment, influence, threatened",
113,"Liability of abettor for an effect caused by the act abetted different from that intended by
the abettor.","When an act is abetted with the intention on the part of the abettor of causing a particular
effect, and an act for which the abettor is liable in consequence of the abetment, causes a different effect
from that intended by the abettor, the abettor is liable for the effect caused, in the same manner and to the
same extent as if he had abetted the act with the intention of causing that effect, provided he knew that the
act abetted was likely to cause that effect. Influence, dominating, instigate",Was the accused instigated by somebody?,Were the intentions of accused different from the second person's intentions,,,,"Influence, dominating, instigate",
114,Abettor present when offence is committed.,"Whenever any person, who is absent would be
liable to be punished as an abettor, is present when the act or offence for which he would be punishable in
consequence of the abetment is committed, he shall be deemed to have committed such act or offence. confederate, ascendancy, intimidate",Was the instigator present at the place where the offence took place,,,,,"confederate, ascendancy, intimidate",
115,"Abetment of offence punishable with death or imprisonment for life -if offence not
committed.","Whoever abets the commission of an offence punishable with death or 1[imprisonment for
life], shall, if that offence be not committed in consequence of the abetment, and no express provision is
made by this Code for the punishment of such abetment, be punished with imprisonment of either
description for a term which may extend to seven years, and shall also be liable to fine;
if act causing harm be done in consequence.—and if any act for which the abettor is liable in
consequence of the abetment, and which causes hurt to any person, is done, the abettor shall be liable to
imprisonment of either description for a term which may extend to fourteen years, and shall also be liable
to fine. Frighten, terrorize, scare,",Was an offence punishable with death or imprisonment of life commited?,,,,,"Frighten, terrorize, scare,","if offence not committed : imprisonment of either  description for a term which may extend to seven years, and shall also be liable to fine                                          if act causing harm be done in consequence: imprisonment of either description for a term which may extend to fourteen years, and shall also be liable  to fine"
116,Abetment of offence punishable with imprisonment—if offence be not committed,"Whoever abets an offence punishable with imprisonment shall, if that offence be not committed in consequence of the abetment, and no express provision is made by this Code for the punishment of such abetment, be punished with imprisonment of any description provided for that offence for a term which may extend to one-fourth part of the longest term provided for that offence; or with such fine as is provided for that offence, or with both; If abettor or person abetted be a public servant whose duty it is to prevent offence.—and if the abettor or the person abetted is a public servant, whose duty it is to prevent the commission of such offence, the abettor shall be punished with imprisonment of any description provided for that offence, for a term which may extend to one-half of the longest term provided for that offence, or with such fine as is provided for the offence, or with both. Illustrations
(a) A offers a bribe to B, a public servant, as a reward for showing A some favour in the exercise of B’s official functions. B refuses to accept the bribe. A is punishable under this sec­tion.
(b) A instigates B to give false evidence. Here, if B does not give false evidence, A has nevertheless committed the offence defined in this section, and is punishable accordingly.
(c) A, a police-officer, whose duty it is to prevent robbery, abets the commission of robbery. Here, though the robbery be not committed, A is liable to one-half of the longest term of impris­onment provided for that offence, and also to fine.
(d) B abets the commission of a robbery by A, a police-officer, whose duty it is to prevent that offence. Here, though the rob­bery be not committed, B is liable to one-half of the longest term of imprisonment provided for the offence of robbery, and also to fine. CLASSIFICATION OF OFFENCE Para I:—Punishment—Imprisonment extending to a quarter part of the longest term, provided for the offence, or fine, or both—Accord­ing to offence abetted is cognizable or non-cognizable—According as offence abetted is bailable or non-bailable—Triable by court by which offence abetted is triable—Non-compoundable. Para II: Punishment—Imprisonment extending to half of the longest term, provided for the offence, or fine, or both—According as offence abetted is cognizable or non-cognizable—According as offence abetted is bailable or non-bailable—Triable by court by which offence abetted is triable—Non-compoundable. bribe, influence, instigate, ",Was an offence punishable imprisonment commited?,,,,,"bribe, influence, instigate, ","if offence be not committed:  imprisonment of any description provided for that offence for a term which  may extend to one-fourth part of the longest term provided for that offence; or with such fine as is  provided for that offence, or with both                                            if abettor or person abetted be a public servant whose duty it is to prevent offence: imprisonment of any description provided for that offence, for  a term which may extend to one-half of the longest term provided for that offence, or with such fine as is  provided for the offence, or with both"
117,Abetting commission of offence by the public or by more than ten persons,"Whoever abets
the commission of an offence by the public generally or by any number or class of persons exceeding ten,
shall be punished with imprisonment of either description for a term which may extend to three years, or
with fine, or with both.
influence, instigate, public, ",Did the accused provoke the public or a group of more than 10 people to commit an offence?,,,,,"influence, instigate, public, ","imprisonment of either description for a term which may extend to three years, or  with fine, or with both"
118,Concealing design to commit offence punishable with death or imprisonment for life,"Whoever intending to facilitate or knowing it to be likely that he will thereby facilitate the commission of
an offence punishable with death or 1[imprisonment for life],
[voluntarily conceals by any act or illegal omission, or by the use of encryption or any other
information hiding tool, the existence of a design] to commit such offence or makes any representation
which he knows to be false respecting such design,
if offence be committed; if offence be not committed.—shall, if that offence be committed, be
punished with imprisonment of either description for a term which may extend to seven years, or, if the
offence be not committed, with imprisonment of either description, for a term which may extend to three
years; and in either case shall also be liable to fine. hide, conceal, ",Did the acused hide the plan of an offence punishable with death or imprisonment for life?,,,,,"hide, conceal","if that offence be committed, be  punished with imprisonment of either description for a term which may extend to seven years, or, if the  offence be not committed, with imprisonment of either description, for a term which may extend to three  years; and in either case shall also be liable to fine"
119,Public servant concealing design to commit offence which it is his duty to prevent,"Whoever, being a public servant intending to facilitate or knowing it to be likely that he will thereby
facilitate the commission of an offence which it is his duty as such public servant to prevent,
1[voluntarily conceals, by any act or illegal omission or by the use of encryption or any other
information hiding tool, the existence of a design] to commit such offence, or makes any representation
which he knows to be false respecting such design
2[imprisonment for life], with imprisonment of either description for a term which may extend to ten
years, officer, prevent, hide, bribe",Did the public servant hide the plan to commit an offence which it is his duty to prevent?,,,,,"officer, prevent, hide, bribe","if the offence be committed, be punished with imprisonment of any  description provided for the offence, for a term which may extend to one-half of the longest term of such  imprisonment, or with such fine as is provided for that offence, or with both                                      if the offence be punishable with death or  2[imprisonment for life], with imprisonment of either description for a term which may extend to ten  years                                       if the offence be not committed, shall be punished with  imprisonment of any description provided for the offence for a term which may extend to one-fourth part  of the longest term of such imprisonment or with such fine as is provided for the offence, or with both"
120,Concealing design to commit offence punishable with imprisonment,"Whoever, intending
to facilitate or knowing it to be likely that he will thereby facilitate the commission of an offence
punishable with imprisonment,
voluntarily conceals, by any act or illegal omission, the existence of a design to commit such offence, or
makes any representation which he knows to be false respecting such design,
if offence be committed; if offence be not committed.—shall, if the offence be committed, be
punished with imprisonment of the description provided for the offence, for a term which may extend to
one-fourth, and, if the offence be not committed, to one-eight, of the longest term of such imprisonment,
or with such fine as is provided for the offence, or with both. ",Did the person hide the plan of an offence punishable with imprisonment?,,,,,,"if the offence be committed, be  punished with imprisonment of the description provided for the offence, for a term which may extend to  one-fourth, and, if the offence be not committed, to one-eight, of the longest term of such imprisonment,  or with such fine as is provided for the offence, or with both."
121,"Waging, or attempting to wage war, or abetting waging of war, against the Government of
India.","Whoever wages war against Indian government or attempts to wage such war, or abets
the waging of such war. war, influence, ",Did the accused attempt or abet to wage a war against the government of India?,,,,,"war, influence","shall be punished with death, or 3[imprisonment for life] 4[and shall also be liable  to fine]"
122,"Collecting arms, etc., with intention of waging war against the Government of India.","Whoever collects men, arms or ammunition or otherwise prepares to wage war with the intention of either
waging or being prepared to wage war against the Indian Government. arms, weapons, war, rally, mobilize",Did the accused collect arms or ammunition to wage a war against the government of India?,,,,,"arms, weapons, war, rally, mobilize","shall be punished with 1
[imprisonment for life] or imprisonment of either description for a term not exceeding ten years, 2
[and
shall also be liable to fine]"
123,Concealing with intent to facilitate design to wage war.—,"Whoever by any act, or by any illegal omission, conceals the existence of a design to wage war against the Inidna government
intending by such concealment to facilitate, or knowing it to be likely that such concealment will
facilitate, the waging of such war, shall be punished with imprisonment of either description for a term
which may extend to ten years, and shall also be liable to fine. war, conceal, hide.",Did the accused hide a plan or design of waging a war against the Government of India?,,,,,"wr, conceal, hide","shall be punished with imprisonment of either description for a term which may extend to ten years, and shall also be liable to fine"
124,"Assaulting President, Governor, etc., with intent to compel or restrain the exercise of any
lawful power.","Whoever, with the intention of inducing or compelling the President of India, Governor of any 
State to exercise or refrain from exercising in any manner any
any of the lawful powers of such President,assaults or wrongfully restrains, or attempts wrongfully to restrain, or overawes, by means of criminal force or the show of criminal force, or attempts so to overawe. ","Did the accused try to assault President, Governor or anyone in power to not exercise their legal powers?",,,,,,"shall be punished with imprisonment of either description for a term which may extend to seven years, and shall also be liable to fine."
125,Waging war against any Asiatic Power in alliance with the Government of India,"Whoever wages war against the Government of any Asiatic Power in alliance or at peace with the Government of India or attempts to wage such war, or abets the waging of such war. ",Did the accused wage a war against any asiatic power in alliance with Government of India?,,,,,,"shall be punished with 1 [imprisonment for life], to which fine may be added, or with imprisonment of either description for a term which may extend to seven years, to which fine may be added, or with fine"
126,Committing depredation on territories of Power at peace with the Government of India,"Whoever commits depredation, or makes preparations to commit depredation, on the territories of any
Power in alliance or at peace with the Government of India",Did the accused attack any territories of power in alliance with Government of India?,,,,,,"shall be punished with imprisonment of either description for a term which may extend to seven years, and shall also be liable to fine and to forfeiture of any property used or intended to be used in committing such depredation, or acquired by such depredation."
127,Receiving property taken by war or depredation mentioned in sections 125 and 126.,"Whoever receives any property knowing the same to have been taken in the commission of any of the
offences which may cause war ",Did the accused receive property taken as a result of waging a war against any asiatic power or territories of power in alliance with India?,,,,,,"shall be punished with imprisonment of either description for a term which may extend to seven years, and shall also be liable to fine and to forfeiture of the property so received"
128,Public servant voluntarily allowing prisoner of state or war to escape,"Whoever, being a
public servant and having the custody of any State prisoner or prisoner of war, voluntarily allows such
prisoner to escape from any place in which such prisoner is confined,",Did the public servant allow the state prisoner or prisoner of war to escape?,,,,,,"shall be punished with 2 [imprisonment for life], or imprisonment of either description for a term which may extend to ten years, and shall also be liable to fine."
129, Public servant negligently suffering such prisoner to escape,"Whoever, being a public
servant and having the custody of any State prisoner or prisoner of war, negligently suffers such prisoner
to escape from any place of confinement in which such prisoner is confined",Did the negligence of the public servant cause the prisoner to escape?,,,,,,"shall be punished with simple imprisonment for a term which may extend to three years, and shall also be liable to fine"
130,"Aiding escape of, rescuing or harbouring such prisoner.","Whoever knowingly aids or assists any State prisoner or prisoner of war in escaping from lawful custody, or rescues or attempts to rescue
any such prisoner, or harbours or conceals any such prisoner who has escaped from lawful custody, or offers or attempts to offer any resistance to the recapture of such prisoner. ",Did the person help the prisoner to escape aur help him hide after he has escaped from lawful custody?,,,,,,"shall be punished with 2 [imprisonment for life], or with imprisonment of either description for a term which may extend to ten years, and shall also be liable to fine."
131,"Abetting mutiny, or attempting to seduce a soldier, sailor or airman from his duty.","Whoever abets the committing of mutiny by an officer, soldier, sailor, airman, Government of India or attempts to seduce any such officer, soldier, sailor or airman from his allegiance or his duty, ",Did the person abet commitment of mutiny?,,,,,,"shall be punished with 2 [imprisonment for life], or with imprisonment of either description for a term which may extend to ten years, and shall also be liable to fine."
133,"Abetment of assault by soldier, sailor or airman on his superior officer, when in execution
of his office.—","Whoever abets an assault by an officer, soldier, sailor or airman, Navy or Air Force of the Government of India , on any superior officer being in the execution of his office.",Did the person abet an assault by an officer or soldier?,,,,,,"shall be punished with imprisonment of either description for a term which may extend to three years, and shall also be liable to fine."
134,"Abetment of such assault, if the assault committed","Whoever abets an assault by an officer,
soldier, sailor or airman,  of the Government of India, on any
superior officer being in the execution of his office. ",Was the abetted assault committed?,,,,,,"be punished with imprisonment of either description for a term which may extend to seven years, and shall also be liable to fine."
135,"Abetment of desertion of soldier, sailor or airman","Whoever, abets the desertion of any officer, soldier, sailor or airman of the Government of India,",Did the person abet the desertion of any officer or soldier?,,,,,,"shall be punished with imprisonment of either description for a term which may extend to two years, or with fine, or with both."
136,Harbouring deserter,"Whoever, except as hereinafter excepted, knowing or having reason to believe that an officer, soldier, sailor or airman Government of India, has deserted, harbours such officer, soldier",Dis the person harbour a deserted soldier or officer?,,,,,,"shall be punished with imprisonment of either description for a term which may extend to two years, or with fine or with both."
137,Deserter concealed on board merchant vessel through negligence of master,"The master or person in charge of a merchant vessel, on board of which any deserter of the Government of India is concealed though ignorant of such concealment,  if he might have known of such concealment but for some neglect of his duty as such master or person in charge, or but for some want of discipline on board of the
vessel.",Did the master of a merchant vessel hide a deserted officer or soldier?,,,,,,be liable to a penalty not exceeding five hundred rupees
138,"Abetment of act of insubordination by soldier, sailor or airman","Whoever abets what he knows to be an act of insubordination by an officer, soldier, sailor or airman of the Government of India, shall, if such act of insubordination be committed in consequence of that abetment.",Did the person abet an act of insubordination?,,,,,,"be punished with imprisonment of either description for a term which may extend to six months, or with fine, or with both"
144,Joining unlawful assembly armed with deadly weapon,"Whoever, being armed with any deadly weapon, or with anything which, used as a weapon of offence, is likely to cause death, is a member of an unlawful assembly. ",Was the person armed with any deadly weapon?,,,,,,"shall be punished with imprisonment of either description for a term  which may extend to two years, or with fine, or with both"
145,"Joining or continuing in unlawful assembly, knowing it has been commanded to disperse.","Whoever joins or continues in an unlawful assembly, knowing that such unlawful assembly
has been commanded in the manner prescribed by law to disperse.",Did the accused continue to be a part of an unlawful assembly which was commanded to disperse by law?,,,,,,"shall be punished with imprisonment  of either description for a term which may extent to two years, or with fine, or with both"
148,"Rioting, armed with deadly weapon","Whoever is guilty of rioting, being armed with a deadly weapon or with anything which, used as a weapon of offence, is likely to cause death          equiped, loaded",Was the person armed with any deadly weapon?,,,,,"equiped, armed, loaded, weapon","shall be punished  with imprisonment of either description for a term which may extend to three years, or with fine, or with  both"
149,"Every member of unlawful assembly guilty of offence committed in prosecution of common
object","If an offence is committed by any member of an unlawful assembly in prosecution of the
common object of that assembly, or such as the members of that assembly knew to be likely to be
committed in prosecution of that object, every person who, at the time of the committing of that offence,
is a member of the same assembly, is guilty of that offence. ","Was the person present at the time when an offence was commited by some member of the unlawful assembly, as a member of that assembly?",,,,,,
150,"Hiring, or conniving at hiring, of persons to join unlawful assembly","Whoever hires or engages, or employs, or promotes, or connives at the hiring, engagement or employment of any person to
join or become a member of any unlawful assembly, shall be punishable as a member of such unlawful assembly, and for any offence which may be committed by any such person as a member of such unlawful assembly in pursuance of such hiring, engagement or employment, in the same manner as if he had been a member of such unlawful assembly, or himself had committed such offence. ",Did the person hire or promote the membership of an unlawful assembly? ,,,,,,
151,"Knowingly joining or continuing in assembly of five or more persons after it has been
commanded to disperse.","Whoever knowingly joins or continues in any assembly of five or more persons likely to cause a disturbance of the public peace, after such assembly has been lawfully commanded to disperse. ",Were you in that crowd?,Did you fight in that crowd?,,,,"disturb, interrupt, public peace","shall be punished with imprisonment of either description for a term which may extend to six months, or with fine, or with both"
152,"Assaulting or obstructing public servant when suppressing riot, etc.—","Whoever assaults or threatens to assault, or obstructs or attempts to obstruct, any public servant in the discharge of his duty as such public servant, in endeavouring to disperse an unlawful assembly, or to suppress a riot or affray, or uses, or threatens, or attempts to use criminal force to such public servant. abuse, assault, resistance, riot, officer, police",Were you involved in fights/hooliganism?,Have you tried to stop the work of government servant?/or threatened?,,,,,"shall be punished with imprisonment of either description for a term which may extend to three years, or with fine, or with both"
153,"Wantonly giving provocation with intent to cause riot—if rioting be committed; if not
committed.—","Whoever malignantly by doing anything which is illegal, gives provocation to any person intending or knowing it to be likely that such provocation will cause the offence of rioting to be committed. rioting, influence",Did the person inhumanely provoke someone which resulted in riots?,,,,,,"be punished with imprisonment of either description for a term which may extend to one year, or with fine, or with both; and if the offence of rioting be not committed, with imprisonment of either description for a term which may extend to six months, or with fine, or with both"
154,Owner or occupier of land on which an unlawful assembly is held.—,"Whenever any unlawful assembly or riot takes place, the owner or occupier of the land upon which such unlawful assembly is held, or such riot is committed, and any person having or claiming an interest in such land. riot, property",Was the person owner of the land where the unlawfull assembly or riot took place?,,,,,,
