1,2,3,4,5,6,7,num,keyword,
300,Murder,"Except in the cases hereinafter excepted, culpable homicide is murder, if the act by
which the death is caused is done with the intention of causing death, or—
2ndly.—If it is done with the intention of causing such bodily injury as the offender knows to be
likely to cause the death of the person to whom the harm is caused, or—
3rdly.—If it is done with the intention of causing bodily injury to any person and the bodily injury
intended to be inflicted is sufficient in the ordinary course of nature to cause death, or—
4thly.—If the person committing the act knows that it is so imminently dangerous that it must, in all
probability, cause death, or such bodily injury as is likely to cause death, and commits such act without
any excuse for incurring the risk of causing death or such injury as aforesaid.
Illustrations
(a) A shoots Z with the intention of killing him. Z dies in consequence. A commits murder.
(b) A, knowing that Z is labouring under such a disease that a blow is likely to cause his death, strikes him with the intention
of causing bodily injury. Z dies in consequence of the blow. A is guilty of murder, although the blow might not have been
sufficient in the ordinary course of nature to cause the death of a person in a sound state of health. But if A, not knowing that Z is
labouring under any disease, gives him such a blow as would not in the ordinary course of nature kill a person in a sound state of
health, here A, although he may intend to cause bodily injury, is not guilty of murder, if he did not intend to cause death, or such
bodily injury as in the ordinary course of nature would cause death.
(c) A intentionally gives Z a sword-cut or club-wound sufficient to cause the death of a man in the ordinary course of nature.
Z dies in consequence. Here A is guilty of murder, although he may not have intended to cause Z's death.
(d) A without any excuse fires a loaded cannon into a crowd of persons and kills one of them. A is guilty of murder,
although he may not have had a premeditated design to kill any particular individual.
Exception 1.—When culpable homicide is not murder.—Culpable homicide is not murder if the
offender, whilst deprived of the power of self-control by grave and sudden provocation, causes the death
of the person who gave the provocation or causes the death of any other person by mistake or accident.
The above exception is subject to the following provisos:—
First.—That the provocation is not sought or voluntarily provoked by the offender as an excuse for
killing or doing harm to any person.
Secondly.—That the provocation is not given by anything done in obedience to the law, or by a public
servant in the lawful exercise of the powers of such public servant.
Thirdly.—That the provocation is not given by anything done in the lawful exercise of the right of
private defence.Explanation.—Whether the provocation was grave and sudden enough to prevent the offence from
amounting to murder is a question of fact.
Illustrations
(a) A, under the influence of passion excited by a provocation given by Z, intentionally kills Y, Z's child. This is murder,
inasmuch as the provocation was not given by the child, and the death of the child was not caused by accident or misfortune in
doing an act caused by the provocation.
(b) Y gives grave and sudden provocation to A. A, on this provocation, fires a pistol at Y, neither intending nor knowing
himself to be likely to kill Z, who is near him, but out of sight. A kills Z. Here A has not committed murder, but merely culpable
homicide.
(c) A is lawfully arrested by Z, a bailiff. A is excited to sudden and violent passion by the arrest, and kills Z. This is murder,
inasmuch as the provocation was given by a thing done by a public servant in the exercise of his powers.
(d) A appears as a witness before Z, a Magistrate. Z says that he does not believe a word of A's deposition, and that A has
perjured himself. A is moved to sudden passion by these words, and kills Z. This is murder.
(e)A attempts to pull Z's nose. Z, in the exercise of the right of private defence, lays hold of A to prevent him from doing so.
A is moved to sudden and violent passion in consequence, and kills Z. This is murder, inasmuch as the provocation was giving by
a thing done in the exercise of the right of private defence.
(f) Z strikes B. B is by this provocation excited to violent rage. A, a bystander, intending to take advantage of B's rage, and
to cause him to kill Z, puts a knife into B's hand for that purpose. B kills Z with the knife. Here B may have committed only
culpable homicide, but A is guilty of murder.
Exception 2.—Culpable homicide is not murder if the offender in the exercise in good faith of the
right of private defence of person or property, exceeds the power given to him by law and causes the
death of the person against whom he is exercising such right of defence without premeditation, and
without any intention of doing more harm than is necessary for the purpose of such defence.
Illustration
Z attempts to horsewhip A, not in such a manner as to cause grievous hurt to A. A draws out a pistol. Z persists in the
assault. A believing in good faith that he can by no other means prevent himself from being horsewhipped, shoots Z dead. A has
not committed murder, but only culpable homicide.
Exception 3.—Culpable homicide is not murder if the offender, being a public servant or aiding a
public servant acting for the advancement of public justice, exceeds the powers given to him by law, and
causes death by doing an act which he, in good faith, believes to be lawful and necessary for the due
discharge of his duty as such public servant and without ill-will towards the person whose death is
caused.
Exception 4.—Culpable homicide is not murder if it is committed without premeditation in a sudden
fight in the heat of passion upon a sudden quarrel and without the offender's having taken undue
advantage or acted in a cruel or unusual manner.
Explanation.—It is immaterial in such cases which party offers the provocation or commits the first
assault.
Exception 5.—Culpable homicide is not murder when the person whose death is caused, being above
the age of eighteen years, suffers death or takes the risk of death with his own consent.
Illustration
A, by instigation, voluntarily causes Z, a person under eighteen years of age to commit suicide. Here, on account of Z's
youth, he was incapable of giving consent to his own death; A has therefore abetted murder",Did criminal had intenion of killing the Victim?,Did criminal knew that victim had problem in the body by which he/she can be killed?,,,,kill intension weapon intention ,"302. Punishment for murder.—Whoever commits murder shall be punished with death or 1 [imprisonment for life], and shall also be liable to fine."
301,"Culpable homicide by causing death of person other than person whose death was
intended.","—If a person, by doing anything which he intends or knows to be likely to cause death,
commits culpable homicide by causing the death of any person, whose death he neither intends nor knows
himself to be likely to cause, the culpable homicide committed by the offender is of the description of
which it would have been if he had caused the death of the person whose death he intended or knew
himself to he likely to cause.",Did the accused cause death of some other person instead of the person he intended to cause death of?,,,,,,
303,Punishment for murder by life-convict,"Whoever, being under sentence of 1
[imprisonment
for life], commits murder, shall be punished with death.",Is the accused under sentence of imprisonment of life?,,,,,,
304,Punishment for culpable homicide not amounting to murder.,"Whoever commits culpable
homicide not amounting to murder, shall be punished with 1
[imprisonment for life], or imprisonment of
either description for a term which may extend to ten years, and shall also be liable to fine, if the act by
which the death is caused is done with the intention of causing death, or of causing such bodily injury as
is likely to cause death;
or with imprisonment of either description for a term which may extend to ten years, or with fine, or
with both, if the act is done with the knowledge that it is likely to cause death, but without any intention
to cause death, or to cause such bodily injury as is likely to cause death.",Did the accused commit culpable homicide but it did not result in murder?,Did the accused have both the knowledge and intention that the commited act would cause death of the person?,,,,Did the accused know that the act is likely to cause death but did not have an intention to cause death?,
305,Abetment of suicide of child or insane person,"If any person under eighteen years of age,
any insane person, any delirious person, any idiot, or any person in a state of intoxication, commits
suicide, whoever abets the commission of such suicide, 
",Did the accused instigate the victim to commit suicide?,Was the victim a person below the age of 18 or insane or intoxicated or in a disturbed state of mind?,,,,,"shall be punished with death or 1 [imprisonment for life], or imprisonment for a term not exceeding ten years, and shall also be liable to fine."
306,Abetment of suicide ,"—If any person commits suicide, whoever abets the commission of such
suicide, ",Did the accused instigate the victim to commit suicide?,,,,,,"shall be punished with imprisonment of either description for a term which may extend to ten years, and shall also be liable to fine."
308,Attempt to commit culpable homicide.,"—Whoever does any act with such intention or
knowledge and under such circumstances that, if he by that act caused death, he would be guilty of
culpable homicide not amounting to murder, shall be punished with imprisonment of either description
for a term which may extend to three years, or with fine, or with both; and, if hurt is caused to any person
by such act, ",did the accused intend to or had the knowledge that his /her act would cause death,,,,,,", if he by that act caused death, he would be guilty of culpable homicide not amounting to murder, shall be punished with imprisonment of either description for a term which may extend to three years, or with fine, or with both; and, if hurt is caused to any person by such act, shall be punished with imprisonment of either description for a term which may extend to seven years, or with fine, or with both"
309,Attempt to commit suicide.—," Whoever attempts to commit suicide and does any act towards
the commission of such offence, ",Did the person attempt to commit suicide?,,,,,,"shall be punished with simple imprisonment for a term which may  extend to one year 2[or with fine, or with both.]"
310,Thug,"Whoever, at any time after the passing of this Act, shall have been habitually associated
with any other or others for the purpose of committing robbery or child-stealing by means of or
accompanied with murder, is a thug.",Did the accused murder someone during commiting a robbery or child-stealing?,,,,,,"sec 311(shall be punished with 3[imprisonment for life], and shall also  be liable to fine)"
312,Causing Miscarraige,"Whoever voluntarily causes a woman with child to miscarry, shall, if such miscarriage be not caused in good faith for the purpose of saving the life of the woman, be punished with imprisonment of either description for a term which may extend to three years, or with fine, or with both; and, if the woman be quick with child,  Explanation.—A woman who causes herself to miscarry, is within the meaning of this section.",Was the miscarriage not caused to save the mother's life?,Was the woman pregnant with a living child?,,,,,"shall, if such miscarriage be not caused in good faith for the purpose of saving the life of the woman, be punished with imprisonment of either description for a term which may extend to three years, or with fine, or with both; and, if the woman be quick with child, shall be punished with imprisonment of either description for a term which may extend to seven years, and shall also be liable to fine."
313,Causing Miscarraige without women's consent,"Whoever commits the offence defined in  the last preceding section without the consent of the woman, whether the woman is quick with child or  not,   ",Was the miscarriage caused without the consent of the mother?,,,,,,"shall be punished with 4 [imprisonment for life], or with imprisonment of either description for a term which may extend to ten years, and shall also be liable to fine"
314,Death caused by act done with intent to cause miscarriage.,"Whoever, with intent to cause the miscarriage of a woman with child, does any act which causes the death of such woman, 
Explanation.—It is not essential to this offence that the offender should know that the act is likely to  cause death. 
",Did the act of miscarriage that was caused also lead to the death of the woman bearing the child?,Was the miscarriage caused without the consent of the mother?,,,,,"shall be punished with imprisonment of either description for a term which may extend to ten years, and shall also be liable to fine; if act done without woman's consent.—and if the act is done without the consent of the woman, shall be punished either with 1 [imprisonment for life], or with the punishment above mentioned."
315,Act done with intent to prevent child being born alive or to cause it to die after birth,"Whoever before the birth of any child does any act with the intention of thereby preventing that child  from being born alive or causing it to die after its birth, and does by such act prevent that child from being  born alive, or causes it to die after its birth, shall, if such act be not caused in good faith for the purpose of  saving the life of the mother, ","Did the accused intend to prevent a childs birth or cause it to die after birth, which was not in consequence of saving the mothers life?",,,,,,"be punished with imprisonment of either description for a term which may extend to ten years, or with fine, or with both."
316,Causing death of quick unborn child by act amounting to culpable homicide.,"Whoever  does any act under such circumstances, that if he thereby caused death he would be guilty of culpable  homicide, and does by such act cause the death of a quick unborn child,",Is the accused guilty of culpable homicide?,Did the act caused death of an unborn living child?,,,,,"shall be punished with imprisonment of either description for a term which may extend to ten years, and shall also be liable to fine."
317,"Exposure and abandonment of child under twelve years, by parent or person having care of it.","Whoever being the father or mother of a child under the age of twelve years, or having the care of  such child, shall expose or leave such child in any place with the intention of wholly abandoning such  child, 
Explanation.—This section is not intended to prevent the trial of the offender for murder or culpable  homicide, as the case may be, if the child die in consequence of the exposure. 
",Is the child under the age of twelve?,Was the child left at the place with the intention of abandoning him?,,,,,"shall be punished with imprisonment of either description for a term which may extend to seven years, or with fine, or with both"
324,Voluntarily causing hurt by dangerous weapons or means.,"Whoever, except in the case
provided for by section 334, voluntarily causes hurt by means of any instrument for shooting, stabbing or
cutting, or any instrument which, used as a weapon of offence, is likely to cause death, or by means of fire
or any heated substance, or by means of any poison or any corrosive substance, or by means of any
explosive substance or by means of any substance which it is deleterious to the human body to inhale, to
swallow, or to receive into the blood, or by means of any animal,     hurt, shooting, cutting, stabbing, weapon, poison, explosives, fire","Was the hurt caused by means of any instrument for shooting, stabbing or cutting, or any instrument which, used as a weapon of offence, is likely to cause death, or by means of fire or any heated substance, or by means of any poison or any corrosive substance, or by means of any explosive substance or by means of any substance which it is deleterious to the human body to inhale, to swallow, or to receive into the blood, or by means of any animal?",Was the hurt not caused on provocation by some other person?,,,,"hurt, shooting, cutting, stabbing, weapon, poison, explosives, fire","shall be punished with imprisonment of either description for a term which may extend to three years, or with fine, or with both."
326,Voluntarily causing grievous hurt by dangerous weapons or means.,"Whoever, except in
the case provided for by section 335, voluntarily causes grievous hurt by means of any instrument for
shooting, stabbing or cutting, or any instrument which, used as a weapon of offence, is likely to cause
death, or by means of fire or any heated substance, or by means of any poison or any corrosive substance,
or by means of any explosive substance, or by means of any substance which it is deleterious to the
human body to inhale, to swallow, or to receive into the blood, or by means of any animal,.      grevious hurt, shooting, cutting, stabbing, weapon, poison, explosives, fire",Was the grevious hurt not caused on provocation by some other person?,"Was the grevious hurt caused by means of any instrument for shooting, stabbing or
cutting, or any instrument which, used as a weapon of offence, is likely to cause death, or by means of fire
or any heated substance, or by means of any poison or any corrosive substance, or by means of any
explosive substance or by means of any substance which it is deleterious to the human body to inhale, to
swallow, or to receive into the blood, or by means of any animal?",,,,"grevious hurt, shooting, cutting, stabbing, weapon, poison, explosives, fire","shall be  punished with 1[imprisonment for life], or with imprisonment of either description for a term which may  extend to ten years, and shall also be liable to fine"
327,"Voluntarily causing hurt to extort property, or to constrain to an illegal to an act","Whoever voluntarily causes hurt, for the purpose of extorting from the sufferer, or from any person
interested in the sufferer, any property or valuable security, or of constraining the sufferer or any person
interested in such sufferer to do anything which is illegal or which may facilitate the commission of an offence,       blackmail, hurt, property, valuables, commit offence",Did the person voluntarily cause hurt to extort property?,,,,,"blackmail, hurt, property, valuables, commit offence","shall be punished with imprisonment of either description for a term which may extend to ten years, and shall also be liable to fine."
328,"Causing hurt by means of poison, etc., with intent to commit and offence.","Whoever
administers to or causes to be taken by any person any poison or any stupefying, intoxicating or
unwholesome drug, or other thing with intent to cause hurt to such person, or with intent to commit or to
facilitate the commission of an offence or knowing it to be likely that he will thereby cause hurt, .   poison, drug, alcoholic, harmful to health",Did the person cause hurt to a person by adminestering poison?,,,,,"poison, drug, alcoholic, harmful to health"," shall be  punished with imprisonment of either description for a term which may extend to ten years, and shall also  be liable to fine"
329,"Voluntarily causing grievous hurt to extort property, or to constrain to an illegal act.","Whoever voluntarily causes grievous hurt for the purpose of extorting from the sufferer or from any
person interested in the sufferer any property or valuable security, or of constraining the sufferer or any
person interested in such sufferer to do anything that is illegal or which may facilitate the commission of
an offence,           blackmail, grevious hurt, property, valuables, commit offence",Did the person voluntarily cause grevious hurt to extort property?,,,,,"blackmail, grevious hurt, property, valuables, commit offence","shall be punished with 1[imprisonment for life], or imprisonment of either description for a  term which may extend to ten years, and shall also be liable to fine"
330,"Voluntarily causing hurt to extort confession, or to compel restoration of property.","Whoever voluntarily causes hurt, for the purpose of extorting from the sufferer or from any person
interested in the sufferer, any confession or any information which may lead to the detection of an offence
or misconduct, or for the purpose of constraining the sufferer or any person interested in the sufferer to
restore or to cause the restoration of any property or valuable security or to satisfy any claim or demand,
or to give information which may lead to the restoration of any property or valuable security,        blackmail, threaten, information,  retake, restore, property",Did the person voluntarily cause hurt to extort confession?,,,,,"blackmail, threaten, information,  retake, restore, property, hurt","punished with imprisonment of either description for a term which may extend to seven years, and shall  also be liable to fine"
331,"Voluntarily causing grievous hurt to extort confession, or to compel restoration of property.","Whoever voluntarily causes grievous hurt for the purpose of extorting from the sufferer or
from any person interested in the sufferer any confession or any information which may lead to the
detection of an offence or misconduct, or for the purpose of constraining the sufferer or any person
interested in the sufferer to restore or to cause the restoration of any property or valuable security, or to
satisfy any claim or demand or to give information which may lead to the restoration of any property or
valuable security, ",Did the person voluntarily cause grevious hurt to extort confession?,,,,,"blackmail, threaten, information,  retake, restore, property, grevious hurt","shall be punished with imprisonment of either description for a term which may extend  to ten years, and shall also be liable to fine."
332,Voluntarily causing hurt to deter public servant from his duty,"Whoever voluntarily causes
hurt to any person being a public servant in the discharge of his duty as such public servant, or with intent
to prevent or deter that person or any other public servant from discharging his duty as such public
servant or in consequence of anything done or attempted to be done by that person in the lawful discharge
of his duty as such public servant,  minister, officer, public servant, hurt, duty, restrict",Did the person voluntarily cause hurt to deter a public servant from his duty?,,,,,"minister, officer, public servant, hurt, duty, restrict","shall be punished with imprisonment of either description for a term  which may extend to three years, or with fine, or with both."
333,Voluntarily causing grievous hurt to deter public servant from his duty.,"Whoever
voluntarily causes grievous hurt to any person being a public servant in the discharge of his duty as such
public servant, or with intent to prevent or deter that person or any other public servant from discharging
his duty as such public servant, or in consequence of anything done or attempted to be done by that
person in the lawful discharge of his duty as such public servant,    minister, officer, public servant, grevious hurt, duty, restrict, refrain",Did the person voluntarily cause grevious hurt to deter a public servant from his duty?,,,,,"minister, officer, public servant, grevious hurt, duty, restrict, refrain","shall be punished with imprisonment of  either description for a term which may extend to ten years, and shall also be liable to fine."
334,Voluntarily causing hurt on provocation.,"Whoever voluntarily causes hurt on grave and
sudden provocation, if he neither intends nor knows himself to be likely to cause hurt to any person other
than the person who gave the provocation,     provoke, instigate, encourage, influence, hurt",Did the person cause hurt to someone on provocation?,,,,,"provoke, instigate, encourage, influence, hurt","shall be punished with imprisonment of either description for a  term which may extend to one month, or with fine which may extend to five hundred rupees, or with both"
335,Voluntarily causing grievous hurt on provocation,"Whoever 1[voluntarily] causes grievous
hurt on grave and sudden provocation, if he neither intends nor knows himself to be likely to cause
grievous hurt to any person other than the person who gave the provocation,     provoke, instigate, encourage, influence, grevious hurt",Did the person cause grevious hurt to someone on provocation?,,,,,"provoke, instigate, encourage, influence, grevious hurt","shall be punished with  imprisonment of either description for a term which may extend to four years, or with fine which may extend to two thousand rupees, or with both"
336,Act endangering life or personal safety of others,"Whoever does any act so rashly or
negligently as to endanger human life or the personal safety of others,      endanger, risk, put in danger, human life, personal security",Did the person commit an act which could endanger human life or personal safety of others?,,,,,"endanger, risk, put in danger, human life, personal security","punished with  imprisonment of either description for a term which may extend to three months or with fine which may  extend to two hundred and fifty rupees, or with both"
