1,2,3,4,5,6,7,num,keyword,
472,"Making or possessing counterfeit seal, etc., with intent to commit forgery punishable under
section 467","Whoever makes or counterfeits any seal, plate or other instrument for making an
impression, intending that the same shall be used for the purpose of committing any forgery which would
be punishable under section 467 of this Code, or, with such intent, has in his possession any such seal,
plate or other instrument, knowing the same to be counterfeit, ",Did the person possess any counterfeited seal to use it for forgery  punishable under sec 467?,,,,,,"shall be punished with 4 [imprisonment for life], or with imprisonment of either description for a term which may extend to seven years, and shall also be liable to fine."
473,"Making or possessing counterfeit seal, etc., with intent to commit forgery punishable
otherwise.","Whoever makes or counterfeits any seal, plate or other instrument for making an impression,
intending that the same shall be used for the purpose of committing any forgery which would be
punishable under any section of this Chapter other than section 467, or, with such intent, has in his
possession any such seal, plate or other instrument, knowing the same to be counterfeit,",Did the person possess any counterfeited seal to use it for forgery not punishable under sec 467?,,,,,,"shall be punished with imprisonment of either description for a term which may extend to seven years, and shall also be liable to fine."
474,"Having possession of document described in section 466 or 467, knowing it to be forged and
intending to use it genuine","
Whoever has in his possession any document or electronic record,
knowing the same to be forged and intending that the same shall fraudulently or dishonestly be used as
genuine, shall, if the document or electronic record is one of the description mentioned in section 466 of
this Code], be punished with imprisonment of either description for a term which may extend to seven
years, and shall also be liable to fine; and if the document is one of the description mentioned in section
467, ",Did the person possess documents described in sec 466 or 467 despite of knowing that they are forged?,,,,,,"be punished with imprisonment of either description for a term which may extend to seven years, and shall also be liable to fine; and if the document is one of the description mentioned in section 467, shall be punished with 4 [imprisonment for life], or with imprisonment of either description, for a term which may extend to seven years, and shall also be liable to fine"
475,"Counterfeiting device or mark used for authenticating documents described in section 467,
or possessing counterfeit marked material","Whoever counterfeits upon, or in the substance of, any
material, any device or mark used for the purpose of authenticating any document described in section
467 of this Code, intending that such device or mark shall be used for the purpose of giving the
appearance of authenticity to any document then forged or thereafter to be forged on such material, or
who, with such intent, has in his possession any material upon or in the substance of which any such
device or mark has been counterfeited, 
",Did the person counterfeit device or mark used for authentication of documents described in sec 467?,,,,,,"shall be punished with 4 [imprisonment for life], or with imprisonment of either description for a term which may extend to seven years, and shall also be liable to fine."
476," Counterfeiting device or mark used for authenticating documents other than those
described in section 467, or possessing counterfeit marked material.—","Whoever counterfeits upon, or
in the substance of, any material, any device or mark used for the purpose of authenticating 
any
document or electronic record] other than the documents described in section 467 of this Code, intending
that such device or mark shall be used for the purpose of giving the appearance of authenticity to any
document then forged or thereafter to be forged on such material, or who with such intent, has in his
possession any material upon or in the substance of which any such device or mark has been
counterfeited, ",Did the person counterfeit device or mark used for authentication of documents othe than described in sec 467?,,,,,,"shall be punished with imprisonment of either description for a term which may extend to seven years, and shall also be liable to fine."
477,"Fraudulent cancellation, destruction, etc., of will, authority to adopt, or valuable
security","Whoever fraudulently or dishonestly, or with intent to cause damage or injury to the public or
to any person, cancels, destroys or defaces, or attempts to cancel, destroy or deface, or secretes or
attempts to secrete any document which is or purports to be a will, or an authority to adopt a son, or any
valuable security, or commits mischief in respect of such document, ",Did the person destroy or deface any document which is or belongs to a will?,,,,,,"shall be punished with 1 [imprisonment for life], or with imprisonment of either description for a term which may extend to seven years, and shall also be liable to fine."
481, Using a false property mark.—,"Whoever marks any movable property or goods or any case,
package or other receptacle containing movable property or goods, or uses any case, package or other
receptacle having any mark thereon, in a manner reasonably calculated to cause it to be believed that the
property or goods so marked, or any property or goods contained in any such receptacle so marked,
belong to a person to whom they do not belong, is said to use a false property mark",Did the person use a property mark which did not belong to him?,,,,,,"482. Punishment for using a false property mark.—Whoever uses 6***any false property mark shall, unless he proves that he acted without intent to defraud, be punished with imprisonment of either description for a term which may extend to one year, or with fine, or with both."
483, Counterfeiting a property mark used by another.—,"Whoever counterfeits any property
mark used by any other person",Did the person fraudulently imitate a property mark of some other person?,,,,,,"shall be punished with imprisonment of either description for a term which may extend to two years, or with fine, or with both"
484,Counterfeiting a mark used by a public servant.,"Whoever counterfeits any property mark
used by a public servant, or any mark used by a public servant to denote that any property has been
manufactured by a particular person or at a particular time or place, or that the property is of a particular
quality or has passed through a particular office, or that it is entitled to any exemption, or uses as genuine
any such mark knowing the same to be counterfeit, ",Did the property mark belong to a public servant?,,,,,,"shall be punished with imprisonment of either description for a term which may extend to three years, and shall also be liable to fine."
485,Making or possession of any instrument for counterfeiting a property mark,"Whoever
makes or has in his possession any die, plate or other instrument for the purpose of counterfeiting a
property mark, or has in his possession a property mark for the purpose of denoting that any goods belong
to a person to whom they do not belong,",Did the person possess any instruments to imitate a property mark belonging to some other person?,,,,,,"shall be punished with imprisonment of either description for a term which may extend to three years, or with fine, or with both"
486, Selling goods marked with a counterfeit property mark,"
[Whoever sells, or exposes, or has
has in possession for sale, any goods or things with a counterfeit property mark] affixed to or impressed
upon the same or to or upon any case, package or other receptacle in which such goods are contained,
shall, unless he proves
(a) that, having taken all reasonable precautions against committing an offence against this section, he
had at the time of the commission of the alleged offence no reason to suspect the genuineness of the mark,
and
(b) that, on demand made by or on behalf of the prosecutor, he gave all the information in his power
with respect to the persons from whom he obtained such goods or things, or
(c) that otherwise he had acted innocently,be punished with imprisonment of either description for a term which may extend to one year, or with
fine, or with both.
be punished with imprisonment of either description for a term which may extend to one year, or with
fine, or with both.
",Did the person sell or have in stock counterfeited property marks?,,,,,,"be punished with imprisonment of either description for a term which may extend to one year, or with fine, or with both"
487,Making a false mark upon any receptacle containing goods,"Whoever makes any false mark upon any case, package or other receptacle containing goods, in a manner reasonably calculated to cause any public servant or any other person to believe that such receptacle contains goods which it does not contain or that it does not contain goods which it does contain, or that the goods contained in such receptacle are of a nature or quality different from the real nature or quality thereof, ","did the accused mark any false mark on goods , or in manner in which the quality is fraudently displayed to be upgraded.",,,,,,"be punished with imprisonment of either description for a term which may extend to three years, or with fine, or with both."
489,Tampering with property mark with intent to cause injury,"—Whoever removes, destroys,
defaces or adds to any property mark, intending or knowing it to be likely that he may thereby cause
injury to any person, ",Did the accused tamper the property mark with an intention to cause injury to someone?,,,,,,"shall be punished with imprisonment of either description for a term which may extend to one year, or with fine, or with both."
491,Breach of contract to attend on and supply wants of helpless person,"Whoever, being bound by a lawful contract to attend on or to supply the wants of any person who, by reason of youth, or of unsoundness of mind, or of a disease or bodily weakness, is helpless or incapable of providing for his own safety or of supplying his own wants, voluntarily omits so to do, ",Did the person who was bound by a contract to help a helpless person not do so?,,,,,,"shall be punished with imprisonment of either description for a term which may extend to three months, or with fine which may extend to two hundred rupees, or with both"
493,Cohabitation caused by a man deceitfully inducing a belief of lawful marriage,"Every man who by deceit causes any woman who is not lawfully married to him to believe that she is lawfully
married to him and to cohabit or have sexual intercourse with him in that belief, ",Are the couple living together without a lawful marriage?,,,,,,"shall be punished with imprisonment of either description for a term which may extend to ten years, and shall also be liable to fine"
494,Marrying again during the lifetime of a husband or wife.—,"Whoever, having a husband or wife
living, marries in any case in which such marriage is void by reason of its taking place during the life of
such husband or wife, .",Was the former wife or husband alive at the time of second marriage?,,,,,,"punished with imprisonment of either description for a term which may extend to seven years, and shall also be liable to fine."
495,"Same offence with concealment of former marriage from person with whom subsequent
marriage is contracted.—","Whoever commits the offence defined in the last preceding section having
concealed from the person with whom the subsequent marriage is contracted, the fact of the former
marriage, ",Did the person hide his first marriage from the person he married next?,,,,,,"shall be punished with imprisonment of either description for a term which may extend to ten years, and shall also be liable to fine"
496,Marriage ceremony fraudulently gone through without lawful marriage.,"496. Marriage ceremony fraudulently gone through without lawful marriage.—Whoever,
dishonestly or with a fraudulent intention, goes through the ceremony of being married, knowing that he
is not thereby lawfully married,     fraud marriage, unlawful marriage",Did the person marry someone fraudulently?,,,,,"fraud marriage, unlawful marriage","shall be punished with imprisonment of either description for a term which 
may extend to seven years, and shall also be liable to fine."
497,Adultery.—,"Whoever has sexual intercourse with a person who is and whom he knows or has
reason to believe to be the wife of another man, without the consent or connivance of that man, such
sexual intercourse not amounting to the offence of rape, is guilty of the offence of adultery, and shall be
punished with imprisonment of either description for a term which may extend to five years, or with fine,
or with both. In such case the wife shall not be punishable as an abettor. sexual intercourse, consent, another man, adultery, abuse",Did the man have consent of the woman's husband?,Did the sexual intercourse amount to offence of rape?,,,,"sexual intercourse, consent, another man, adultery, abuse","punished with imprisonment of either description for a term which may extend to five years, or with fine, or with both. In such case the wife shall not be punishable as an abettor."
498,Enticing or taking away or detaining with criminal intent a married woman.—,".Whoever takes or entices away any woman who is and whom he knows or has reason to believe to be the wife of
any other man, from that man, or from any person having the care of her on behalf of that man, with
intent that she may have illicit intercourse with any person, or conceals or detains with that intent any
such woman, shall be punished with imprisonment of either description for a term which may extend to
two years, or with fine, or with both. take away, another man, illegal intercourse",Did the person take away a married woman from her husband to have illicit intercourse with someone?,,,,,"take away, another man, illegal intercourse","punished with imprisonment of either description for a term which may extend to two years, or with fine, or with both."
501,Printing or engraving matter known to be defamatory.—,"Whoever prints or engraves any matter, knowing or having good reason to believe that such matter is defamatory of any person, shall be punished with simple imprisonment for a term which may extend to two years, or with fine, or with both.   defaming, printing, damaging reputation",Did the accused print any defamatory matter?,,,,,"defaming, printing, damaging reputation","shall be punished with simple imprisonment for a term which may extend to two years, or with fine, or with both."
502,Sale of printed or engraved substance containing defamatory matter.—,"Whoever sells or offers for sale any printed or engraved substance containing defamatory matter, knowing that it contains such matter, shall be punished with simple imprisonment for a term which may extend to two years, or with fine, or with both   defaming, printing, damaging reputation, selling",Did the accused sell any printed substance containing defamatory matter?,,,,,"defaming, printing, damaging reputation, selling","shall be punished with simple imprisonment for a term which may extend to two years, or with fine, or with both."
503,Criminal intimidation,"Whoever threatens another with any injury to his person, reputation or
property, or to the person or reputation of any one in whom that person is interested, with intent to cause
alarm to that person, or to cause that person to do any act which he is not legally bound to do, or to omit
to do any act which that person is legally entitled to do, as the means of avoiding the execution of such
threat, commits criminal intimidation.
Explanation.—A threat to injure the reputation of any deceased person in whom the person threatened
is interested, is within this section.
Illustration
A, for the purpose of inducing B to resist from prosecuting a civil suit, threatens to burn B's house. A is guilty of criminal
intimidation.  threatened, forced, injure, frighten",Did the person threaten to injure the victim or his reputation?,,,,,"threatened, forced, injure, frighten","506. Punishment for criminal intimidation.—Whoever commits the offence of criminal intimidation 
shall be punished with imprisonment of either description for a term which may extend to two years, or 
with fine, or with both;
If threat be to cause death or grievous hurt, etc.—and if the threat be to cause death or grievous hurt, 
or to cause the destruction of any property by fire, or to cause an offence punishable with death or 
1
[imprisonment for life], or with imprisonment for a term which may extend to seven years, or to impute 
unchastity to a woman, shall be punished with imprisonment of either description for a term which may 
extend to seven years, or with fine, or with both."
504,Intentional insult with intent to provoke a breach of the peace.—,"Whoever intentionally insults, and thereby gives provocation to any person, intending or knowing it to be likely that such provocation will cause him to break the public peace, or to commit any other offence, shall be punished with imprisonment of either description for a term which may extend to two years, or with fine, or with both.    insult, instigate, provoke, public peace",Did the insult provoke the victim to break public peace?,,,,,"insult, instigate, provoke, public peace","shall be punished with imprisonment of either description for a term which may extend to two years, or with fine, or with both"
507,Criminal intimidation by an anonymous communication.—,"Whoever commits the offence of
criminal intimidation by an anonymous communication, or having taken precaution to conceal the name
or abode of the person from whom the threat comes, shall be punished with imprisonment of either
description for a term which may extend to two years, in addition to the punishment provided for the
offence by the last preceding section.   unknown, hide, criminal intimidation, conceal",Did the person giving threats hide his identity?,,,,,"unknown, hide, criminal intimidation, conceal","shall be punished with imprisonment of either description for a term which may extend to two years, in addition to the punishment provided for the offence by the last preceding section."
508, Act caused by inducing person to believe that he will be rendered an object of the Divine displeasure.,"Whoever voluntarily causes or attempts to cause any person to do anything which that person is not legally bound to do, or to omit to do anything which he is legally entitled to do, by inducing or attempting to induce that person to believe that he or any person in whom he is interested will become or will be rendered by some act of the offender an object of Divine displeasure if he does not do the thing which it is the object of the offender to cause him to do, or if he does the thing which it is the object of the offender to cause him to omit, shall be punished with imprisonment of either description for a term which may extend to one year, or with fine, or with both",Did the accused try to insult a woman or invade her privacy?,,,,, ,"shall be punished with imprisonment of either description for a term which may extend to one year, or with fine, or with both."
509,Misconduct in public by a drunken person.—,"Whoever, in a state of intoxication, appears in
any public place, or in any place which it is a trespass in him to enter, and there conducts himself in such
a manner as to cause annoyance to any person, shall be punished with simple imprisonment for a term
which may extend to twenty-four hours, or with fine which may extend to ten rupees, or with both.     drunk, annoy, disturb, public place, misbehave
",Did the person in a state of intoxication cause annoyance to public?,,,,,"drunk, annoy, disturb, public place, misbehave","shall be punished with simple imprisonment for a term which may extend to twenty-four hours, or with fine which may extend to ten rupees, or with both"
510,"Word, gesture or act intended to insult the modesty of a woman.—","Whoever, intending to
insult the modesty of any woman, utters any words, makes any sound or gesture, or exhibits any object,
intending that such word or sound shall be heard, or that such gesture or object shall be seen, by such
woman, or intrudes upon the privacy of such woman, 1[shall be punished with simple imprisonment for a
term which may extend to three years, and also with fine     insult, molest, disturb privacy, woman",Did the person insult the modesty of a woman with his behaviour or words?,,,,,"insult, molest, disturb privacy, woman","shall be punished with simple imprisonment for a 
term which may extend to three years, and also with fine"
108A,Abetment in India of offences outside India,"A person abets an offence within the
meaning of this Code who, in India, abets the commission of any act without and beyond 2[India]
which would constitute an offence if committed in India.",Was the accused instigated by somebody?,Is the accused an Indian Citizen?,,,,,
121A,Conspiracy to commit offences punishable by section 121,"Whoever within or without

India conspires to commit any of the offences punishable by section 121,  or conspires to
overawe, by means of criminal force or the show of criminal force, he Central Government or any
State Government , 
Explanation.—To constitute a conspiracy under this section, it is not necessary that any act or illegal
omission shall take place in pursuance thereof.",Did the accused conspire to wage a war against the government of India?,,,,,,"shall be punished with 14[imprisonment for life], or with imprisonment of either description which may extend to ten years, 15[and shall also be liable to fine]."
124A.,Sedition,"124A. Sedition.—Whoever by words, either spoken or written, or by signs, or by visible
representation, or otherwise, brings or attempts to bring into hatred or contempt, or excites or attempts to
excite disaffection towards,  the Government established by law in [India],  
Explanation 1.—The expression “disaffection” includes disloyalty and all feelings of enmity.
Explanation 2.—Comments expressing disapprobation of the measures of the Government with a
view to obtain their alteration by lawful means, without exciting or attempting to excite hatred, contempt
or disaffection, do not constitute an offence under this section.
Explanation 3.—Comments expressing disapprobation of the administrative or other action of the
Government without exciting or attempting to excite hatred, contempt or disaffection, do not constitute an
offence under this section.",Did the person try to spread hatred or provoke people against the government?,,,,,," shall be punished  with 16[imprisonment for life], to which fine may be added, or with imprisonment which may extend to  three years, to which fine may be added, or with fine"
153A.,"Promoting enmity between different groups on ground of religion, race, place of birth,
residence, language, etc., and doing acts prejudicial to maintenance of harmony.—","(a) by words, either spoken or written, or by signs or by visible representations or otherwise, promotes or attempts to promote, on grounds of religion, race, place of birth, residence, language, caste or community or any other ground whatsoever, disharmony or feelings of enmity, hatred or illwill between different religious, racials, language or regional groups or castes or communities, or 1. Subs. by Act 35 of 1969, s. 2, for section 153A. 42 (b) commits any act which is prejudicial to the maintenance of harmony between different religious, racial, language or regional groups or castes or communities, and which disturbs or is likely to disturb the public tranquillity, 1 [or] 1 [(c) organizes any exercise, movement, drill or other similar activity intending that the participants in such activity shall use or be trained to use criminal force or violence or knowing it to be likely that the participants in such activity will use or be trained to use criminal force or violence, or participates in such activity intending to use or be trained to use criminal force or violence or knowing it to be likely that the participants in such activity will use or be trained to use criminal force or violence, against any religious, racial, language or regional group or caste or community and such activity for any reason whatsoever causes or is likely to cause fear or alarm or a feeling of insecurity amongst members of such religious, racial, language or regional group or caste or community,] shall be punished with imprisonment which may extend to three years, or with fine, or with both. (2) Offence committed in place of worship, etc.—Whoever commits an offence specified in sub-section (1) in any place of worship or in any assembly engaged in the performance of religious worship or religious ceremonies, shall be punished with imprisonment which may extend to five years and shall also be liable to fine.]",Did you create enmity through casteism?,Did you encourage discrimination against caste between two people?,,,,,"shall be punished with imprisonment which may extend to three years, or with fine, or with both.                                                          Offence committed in place of worship,                                                                                                                            shall be punished with imprisonment which may extend to five years and shall also 
be liable to fine"
